{
  "schema_version": "x07.mcp.trust.lock@0.1.0",
  "framework_id": "dev_local_trust_framework_v1",
  "generated_at": "2026-02-16T00:00:00Z",
  "bundles": [
    {
      "id": "dev_trust_bundle_v1",
      "path": "../bundles/dev_trust_bundle_v1.trust_bundle.json",
      "bundle_sha256": "64d6487ff2be3d53870782aeffcc95a27ccabc9b3317eaccb3b4b51df6d5919d",
      "sig_jwt_path": "../bundles/dev_trust_bundle_v1.trust_bundle.sig.jwt",
      "sig_jwt_sha256": "fa3bc9526698969f9e2ae23fa48541954d4695a5c86e8430941e7945fc53cb4c",
      "publisher_issuer": "https://policy.example",
      "kid": "prm-ed25519-2026-01",
      "alg": "Ed25519"
    }
  ]
}
